id,nome,sku,preco_original,preco_promocional,categorias,descricao,url,timestamp,http_status
130111,Lentes de Contato Acuvue Oasys 1-Day com Hydraluxe,130111,269.29,225.54,Lentes de contato,Acuvue Oasys 1-Day com Hydraluxe é desenvolvida para quem faz uso frequente de aparelhos digitais e não abre mão de conforto e saúde ocular.,https://www.newlentes.com.br/produto/lentes-de-contato-acuvue-oasys-1-day-com-hydraluxe-130111,2026-01-28T15:45:21.989Z,200
71294,Lentes de Contato 1-Day Acuvue Moist,71294,303.36,287.89,Lentes de contato,Compre lentes Acuvue 1-Day Moist da Johnson & Johnson aqui na Newlentes. Compra segura com Frete Grátis e Desconto no pagamento á vista.,https://www.newlentes.com.br/produto/lentes-de-contato-1-day-acuvue-moist-71294,2026-01-28T15:45:30.824Z,200
130011,Lentes de Contato Clariti 1 Day,130011,303.36,266.72,Lentes de contato,Compre as Lentes de Contato Clariti 1 Day da CooperVision aqui na NewLentes com frete grátis* e parcelado sem juros. Lentes novas todos os dias!,https://www.newlentes.com.br/produto/lentes-de-contato-clariti-1-day-130011,2026-01-28T15:45:38.990Z,200
134500,Lentes de contato Acuvue Oasys 1-Day com Hydraluxe para astigmatismo,134500,350.29,316.99,Lentes de contato,"Compre Lentes de contato Acuvue Oasys 1-Day com Hydraluxe para astigmatismo do fabricante Acuvue por apenas R$ 283,46 aqui na Newlentes. Somos revendedor autorizado Acuvue",https://www.newlentes.com.br/produto/lentes-de-contato-acuvue-oasys-1-day-com-hydraluxe-para-astigmatismo-134500,2026-01-28T15:46:20.036Z,200
130062,Lentes de Contato 1-Day Acuvue Moist Multifocal,130062,319.33,303.36,Lentes de contato,Compre as Lentes 1-Day Acuvue Moist Multifocal aqui na NewLentes com as melhores vantagens. Aproveite!,https://www.newlentes.com.br/produto/lentes-de-contato-1-day-acuvue-moist-multifocal-130062,2026-01-28T15:46:29.645Z,200
129924,Lentes de contato Soflens Daily,129924,339.99,266.72,Lentes de contato,Lentes de contato Soflens Daily da Bausch Lomb você encontra aqui na NewLentes. Compra Segura com Frete Grátis e Desconto à vista.,https://www.newlentes.com.br/produto/lentes-de-contato-soflens-daily-129924,2026-01-28T15:46:39.909Z,200
136766,Lentes de Contato Ultra One Day,136766,420.99,316.99,Lentes de contato,"Compre Lentes de Contato Ultra One Day do fabricante Bausch Lomb por apenas R$ 206,36 aqui na Newlentes. Somos revendedor autorizado Bausch Lomb",https://www.newlentes.com.br/produto/lentes-de-contato-ultra-one-day-136766,2026-01-28T15:46:49.692Z,200
130012,Lentes de Contato Clariti 1 Day Tórica,130012,437,359.1,Lentes de contato,"Compre as Lentes de Contato Clariti 1 Day Tórica com frete gratis*, desconto à vista ou parcelamento sem juros. Aproveite!",https://www.newlentes.com.br/produto/lentes-de-contato-clariti-1-day-torica-130012,2026-01-28T15:46:57.285Z,200
135836,Lentes de contato Precision 1 Day,135836,287.89,270,Lentes de contato,"Compre Lentes de contato Precision 1 Day do fabricante Alcon por apenas R$ 215,79 aqui na Newlentes. Somos revendedor autorizado Alcon",https://www.newlentes.com.br/produto/lentes-de-contato-precision-1-day-135836,2026-01-28T15:47:05.727Z,200
129805,Lentes de Contato Proclear 1 Day,129805,303.36,287.89,Lentes de contato,Lentes de Contato Proclear 1 Day,https://www.newlentes.com.br/produto/lentes-de-contato-proclear-1-day-129805,2026-01-28T15:47:17.130Z,200
129925,Lentes de contato Biotrue ONEDay,129925,303.36,287.89,Lentes de contato,Compre lentes de contato Biotrue ONEday da Bausch Lomb aqui na NewLentes. Compra Segura com Frete Grátis e Desconto à vista.,https://www.newlentes.com.br/produto/lentes-de-contato-biotrue-oneday-129925,2026-01-28T15:47:26.872Z,200
130228,Lentes de contato Aveo Hello - Descarte diário,130228,303.36,287.89,Lentes de contato,"As lentes Aveo Hello se tornou uma marca exclusiva na NewLentes. Compre com segurança, frete grátis* e desconto no pagamento à vista!",https://www.newlentes.com.br/produto/lentes-de-contato-aveo-hello-descarte-diario-130228,2026-01-28T15:47:35.598Z,200
130013,Lentes de Contato Clariti 1 Day Multifocal,130013,420.99,420,Lentes de contato,Compre as Lentes de Contato Clariti 1 Day Multifocal aqui na NewLentes com frete grátis*. Aproveite nosso desconto à vista. Confira!,https://www.newlentes.com.br/produto/lentes-de-contato-clariti-1-day-multifocal-130013,2026-01-28T15:47:44.374Z,200
129832,Lentes de Contato Dailies AquaComfort Plus Multifocal,129832,420.99,420,Lentes de contato,Lentes de Contato Dailies AquaComfort Plus Multifocal,https://www.newlentes.com.br/produto/lentes-de-contato-dailies-aquacomfort-plus-multifocal-129832,2026-01-28T15:47:54.816Z,200
134493,Lentes de contato coloridas Bioblue Color 1-Day - Sem grau,134493,199.99,186.2,Lentes de contato,"Compre Lentes de contato coloridas Bioblue Color 1-Day - Sem grau do fabricante Central Oftálmica por apenas R$ 148,00 aqui na Newlentes. Somos revendedor autorizado Central Oftálmica",https://www.newlentes.com.br/produto/lentes-de-contato-coloridas-bioblue-color-1-day-sem-grau-134493,2026-01-28T15:48:03.622Z,200
130897,Lentes de Contato BioSoft One Day,130897,149,123.5,Lentes de contato,"Compre lentes de contato Biosoft 1-Day aqui na NewLentes com entrega garantida para todo Brasil, aproveite nossa promoção de frete grátis*",https://www.newlentes.com.br/produto/lentes-de-contato-biosoft-one-day-130897,2026-01-28T15:48:12.539Z,200
71298,Lentes de Contato Acuvue Oasys,71298,247.01,234.66,Lentes de contato,Precisando de lentes Acuvue Oasys? Temos a pronta entrega e você ainda ganha Frete Grátis* para todo Brasil.,https://www.newlentes.com.br/produto/lentes-de-contato-acuvue-oasys-71298,2026-01-28T15:48:21.010Z,200
71326,Lentes de Contato Acuvue Oasys Astigmatismo,71326,350.29,316.99,Lentes de contato,Lentes Oasys para Astigmatismo com frete grátis* para todo Brasil. Compra segura e menor prazo de entrega. Confira!,https://www.newlentes.com.br/produto/lentes-de-contato-acuvue-oasys-astigmatismo-71326,2026-01-28T15:48:30.985Z,200
71290,Lentes de Contato Acuvue 2,71290,189.56,180.08,Lentes de contato,Compre lentes Acuvue 2 com frete grátis* para todo Brasil. Compra segura com menor prazo de entrega. Confira!,https://www.newlentes.com.br/produto/lentes-de-contato-acuvue-2-71290,2026-01-28T15:48:40.242Z,200
130908,Lentes de Contato Acuvue Oasys Transitions,130908,350.29,303.36,Lentes de contato,"A tecnologia Transitions agora em lentes de contato! Confira as lentes Acuvue Oasys Transitions, o último lançamento da Johnson & Johnson.",https://www.newlentes.com.br/produto/lentes-de-contato-acuvue-oasys-transitions-130908,2026-01-28T15:48:51.378Z,200
71259,Lentes de Contato Soflens 59,71259,158.9,150.96,Lentes de contato,Compre lentes de contato Soflens 59 da Bausch Lomb aqui na NewLentes. Loja referência em lentes de contato desde 2010. Aproveite o Frete Grátis*.gamento á vista.,https://www.newlentes.com.br/produto/lentes-de-contato-soflens-59-71259,2026-01-28T15:49:00.913Z,200
71305,Lentes de contato Biofinity,71305,236.84,225,Lentes de contato,Compre lente de contato Biofinity com um clique e ainda ganha Frete Grátis* para todo Brasil. Aproveite também nosso desconto à vista.,https://www.newlentes.com.br/produto/lentes-de-contato-biofinity-71305,2026-01-28T15:49:09.366Z,200
71245,Lentes de Contato Soflens Toric,71245,570,350,Lentes de contato,"Lentes Soflens Toric para cuidar do seu astigmatismo, você encontra aqui na NewLentes. Aproveite nosso frete grátis* e preço baixo. Confira!",https://www.newlentes.com.br/produto/lentes-de-contato-soflens-toric-71245,2026-01-28T15:49:18.691Z,200
71301,Lentes de Contato Biofinity Toric,71301,570,368.42,Lentes de contato,Compre lentes de contato Biofinity Toric da Coopervision aqui na NewLentes. Aproveite hoje nosso Frete Grátis* para todo Brasil e desconto à vista.,https://www.newlentes.com.br/produto/lentes-de-contato-biofinity-toric-71301,2026-01-28T15:49:27.992Z,200
130040,Lentes de Contato Air Optix Plus Hydraglyde,130040,236.84,225,Lentes de contato,Compre lentes de contato Air Optix Hydraglyde da Alcon aqui na NewLentes. Compre com Frete Grátis e Desconto no pagamento à vista.,https://www.newlentes.com.br/produto/lentes-de-contato-air-optix-plus-hydraglyde-130040,2026-01-28T15:49:35.553Z,200
130118,Lentes de Contato Avaira Vitality,130118,303.36,266.72,Lentes de contato,As lentes Avaira agora são Avaira Vitality. O fabricante CooperVision inovou no produto trazendo um upgrade sem esforço para você que usa lentes Avaira. Saiba mais!,https://www.newlentes.com.br/produto/lentes-de-contato-avaira-vitality-130118,2026-01-28T15:49:45.059Z,200
129774,Lentes de contato Air Optix Colors - COM GRAU,129774,173.68,165,Lentes de contato,Lentes de contato Air Optix Colors,https://www.newlentes.com.br/produto/lentes-de-contato-air-optix-colors-com-grau-129774,2026-01-28T15:49:54.885Z,200
130906,Lentes de Contato Air Optix Plus Hydraglyde Astigmatism,130906,420,350,Lentes de contato,Compre as lentes de contato Air Optix Plus Hydraglyde para Astigmatism com frete grátis* para todo Brasil. E ainda ganha desconto à vista.,https://www.newlentes.com.br/produto/lentes-de-contato-air-optix-plus-hydraglyde-astigmatism-130906,2026-01-28T15:50:04.211Z,200
71261,Lentes de Contato Purevision 2,71261,386.99,303.36,Lentes de contato,Compre lentes de contato Purevision 2 da Bausch Lomb aqui na NewLentes. Compra segura com frete grátis* para todo Brasil e desconto à vista.,https://www.newlentes.com.br/produto/lentes-de-contato-purevision-2-71261,2026-01-28T15:50:46.956Z,200
71315,Lentes de Contato Solflex CL,71315,266.72,217.55,Lentes de contato,Compre lentes de contato com grau Solflex CL da Solótica aqui na NewLentes. Compra segura com frete grátis* e desconto no pagamento à vista.,https://www.newlentes.com.br/produto/lentes-de-contato-solflex-cl-71315,2026-01-28T15:50:55.954Z,200
130119,Lentes de contato Ultra com MoistureSeal,130119,420.99,316.99,Lentes de contato,Compre aqui as lentes Ultra da Bausch Lomb. Aproveite nossa promoção de frete grátis* e desconto no pagamento à vista.,https://www.newlentes.com.br/produto/lentes-de-contato-ultra-com-moistureseal-130119,2026-01-28T15:51:06.876Z,200
71306,Lentes de Contato Proclear,71306,303.36,266.72,Lentes de contato,Compre lentes de contato Proclear da Coopervision aqui na NewLentes. Compra Segura com Frete Grátis para todo Brasil e Desconto no pagamento à vista.,https://www.newlentes.com.br/produto/lentes-de-contato-proclear-71306,2026-01-28T15:51:17.337Z,200
71308,Lentes de Contato Biomedics 55 Evolution,71308,303.36,269.29,Lentes de contato,Compre lentes de contato Biomedics 55 Evolution da Coopervision aqui na NewLentes. Compra Segura com Frete Grátis e Desconto no pagamento à vista.,https://www.newlentes.com.br/produto/lentes-de-contato-biomedics-55-evolution-71308,2026-01-28T15:51:26.426Z,200
71258,Lentes de Contato Soflens Multi-Focal,71258,357.88,339.99,Lentes de contato,Compre lentes de contato Soflens Multifocal da Bausch Lomb aqui na NewLentes. Compra segura com frete grátis* e desconto à vista.,https://www.newlentes.com.br/produto/lentes-de-contato-soflens-multi-focal-71258,2026-01-28T15:51:34.158Z,200
71297,Lentes de Contato Biofinity Multifocal,71297,380,361,Lentes de contato,Compre lentes de contato Biofinity Multifocal da Coopervision aqui na NewLentes. Compra Segura com Frete Grátis e Desconto à vista.,https://www.newlentes.com.br/produto/lentes-de-contato-biofinity-multifocal-71297,2026-01-28T15:51:42.515Z,200
129789,Lentes de contato coloridas Solflex Natural Colors - Sem grau,129789,186.2,165,Lentes de contato,"Compre Lentes de contato coloridas Solflex Natural Colors - Sem grau do fabricante Solótica por apenas R$ 107,00 aqui na Newlentes. Somos revendedor autorizado Solótica",https://www.newlentes.com.br/produto/lentes-de-contato-coloridas-solflex-natural-colors-sem-grau-129789,2026-01-28T15:51:51.665Z,200
133478,Lentes de Contato Air Optix Plus Hydraglyde Multifocal,133478,442.1,420,Lentes de contato,"Compre Lentes de Contato Air Optix Plus Hydraglyde Multifocal do fabricante Alcon por apenas R$ 442,10 aqui na Newlentes. Somos revendedor autorizado Alcon",https://www.newlentes.com.br/produto/lentes-de-contato-air-optix-plus-hydraglyde-multifocal-133478,2026-01-28T15:51:59.671Z,200
130318,Lentes de contato coloridas Hidrocor mensal - Sem grau,130318,186.2,165,Lentes de contato,Lentes de Contato Coloridas Hidrocor disponíveis em 5 cores.,https://www.newlentes.com.br/produto/lentes-de-contato-coloridas-hidrocor-mensal-sem-grau-130318,2026-01-28T15:52:09.541Z,200
129762,Lentes de contato coloridas Air Optix Colors - Sem grau,129762,186.2,173.68,Lentes de contato,Lentes de contato Air Optix Colors,https://www.newlentes.com.br/produto/lentes-de-contato-coloridas-air-optix-colors-sem-grau-129762,2026-01-28T15:52:20.117Z,200
134364,Lentes de contato Biofinity Energys,134364,303.36,266.72,Lentes de contato,As lentes Biofinity Energys é o produto premium da marca CooperVision. Compre sem sair de casa com frete grátis. Aproveite!,https://www.newlentes.com.br/produto/lentes-de-contato-biofinity-energys-134364,2026-01-28T15:52:29.147Z,200
129698,Lentes de Contato Colorida Lunare Tri-Kolor Mensal - COM GRAU,129698,149,133,Lentes de contato,Lentes de Contato Colorida Lunare Tri-Kolor Mensal,https://www.newlentes.com.br/produto/lentes-de-contato-colorida-lunare-tri-kolor-mensal-com-grau-129698,2026-01-28T15:52:39.393Z,200
129784,Lentes de contato coloridas Soflens StarColors II - Sem grau,129784,199.99,186.2,Lentes de contato,Lentes de Contato Colorida SOFLENS STARCOLORS II,https://www.newlentes.com.br/produto/lentes-de-contato-coloridas-soflens-starcolors-ii-sem-grau-129784,2026-01-28T15:52:48.207Z,200
130227,Lentes de contato coloridas Natural Vision mensal - Sem grau,130227,186.2,149,Lentes de contato,"Novidade no mundo de lentes de contato, as lentes Natural Vision vieram com mais de 15 cores disponíveis. Aproveite nosso frete grátis* e desconto à vista.",https://www.newlentes.com.br/produto/lentes-de-contato-coloridas-natural-vision-mensal-sem-grau-130227,2026-01-28T15:52:58.011Z,200
130206,Lentes de Contato Natural Vision Mensal,130206,149,146.3,Lentes de contato,Lentes Natural Vision você encontra aqui na NewLentes. Receba no seu endereço com Frete Grátis* e desconto no pagamento à vista. Aproveite!,https://www.newlentes.com.br/produto/lentes-de-contato-natural-vision-mensal-130206,2026-01-28T15:53:09.472Z,200
130121,Lentes de Contato Biofinity XR Toric - Graus Altos,130121,600,570,Lentes de contato,Tem grau alto e com astigmatismo? As lentes de contato Biofinity XR Toric atendem sua necessidade. Aproveite nosso frete grátis e desconto à vista. Confira!,https://www.newlentes.com.br/produto/lentes-de-contato-biofinity-xr-toric-graus-altos-130121,2026-01-28T15:53:19.589Z,200
130120,Lentes de Contato Biofinity XR - Graus Altos,130120,570,361,Lentes de contato,"Lentes Biofinity XR para graus altos de miopia ou hipermetropia, você encontra aqui na NewLentes. Aproveite nosso frete grátis* para todo Brasil.",https://www.newlentes.com.br/produto/lentes-de-contato-biofinity-xr-graus-altos-130120,2026-01-28T15:53:28.644Z,200
71322,Lentes de Contato Colorida Hidrocor - COM GRAU,71322,149,133,Lentes de contato,Compre lentes de contato colorida Hidrocor da Solótica aqui na NewLentes. São diversas cores e você ainda ganha frete grátis* para todo Brasil.,https://www.newlentes.com.br/produto/lentes-de-contato-colorida-hidrocor-com-grau-71322,2026-01-28T15:54:12.111Z,200
71324,Lentes de Contato Colorida Natural Colors - COM GRAU,71324,149,97,Lentes de contato,Compre lentes de contato colorida Natural Colors da Solótica aqui na NewLentes. São diversas cores e você ainda ganha frete grátis* para todo Brasil.,https://www.newlentes.com.br/produto/lentes-de-contato-colorida-natural-colors-com-grau-71324,2026-01-28T15:54:22.831Z,200
129782,Lentes de contato coloridas Hidrocor - Kit sem grau,129782,199.99,196,Lentes de contato,"Compre Lentes de contato coloridas Hidrocor - Kit sem grau do fabricante Solótica por apenas R$ 196,00 aqui na Newlentes. Somos revendedor autorizado Solótica",https://www.newlentes.com.br/produto/lentes-de-contato-coloridas-hidrocor-kit-sem-grau-129782,2026-01-28T15:55:05.733Z,200
129735,Lentes de Contato SoftFlex 55w,129735,287.89,269.29,Lentes de contato,Compre lentes de contato Softflex 55w aqui na NewLentes. Compra Segura com Frete Grátis para todo Brasil e Desconto no pagamento à vista.,https://www.newlentes.com.br/produto/lentes-de-contato-softflex-55w-129735,2026-01-28T15:55:13.816Z,200
129699,Lentes de Contato Colorida Lunare Tri-Kolor Anual - COM GRAU,129699,149,105.25,Lentes de contato,Compre lentes de contato colorida Lunare da Bausch Lomb aqui na Newlentes. Compra segura com frete grátis* e desconto à vista.,https://www.newlentes.com.br/produto/lentes-de-contato-colorida-lunare-tri-kolor-anual-com-grau-129699,2026-01-28T15:55:24.480Z,200
71299,Lentes de Contato Colorida Magic Top - COM GRAU,71299,149,140,Lentes de contato,Compre lentes de contato colorida Optycolor Magic Top aqui na NewLentes. Compra Segura com Frete Grátis para todo Brasil e Desconto no pagamento à vista.,https://www.newlentes.com.br/produto/lentes-de-contato-colorida-magic-top-com-grau-71299,2026-01-28T15:55:35.058Z,200
71260,Lentes de Contato Optima 38,71260,269.29,234.66,Lentes de contato,Lentes Optima 38 da Bausch Lomb com Frete Grátis* para todo Brasil. Compre com segurança em clique. Confira!,https://www.newlentes.com.br/produto/lentes-de-contato-optima-38-71260,2026-01-28T15:55:43.522Z,200
71320,Lentes de Contato Hidrosoft,71320,210.59,149,Lentes de contato,Compre lentes de contato com grau Hidrosoft da Solótica aqui na NewLentes. Compra segura e desconto no pagamento à vista.,https://www.newlentes.com.br/produto/lentes-de-contato-hidrosoft-71320,2026-01-28T15:55:51.648Z,200
71285,Lentes de Contato Optima FW,71285,303.36,269.29,Lentes de contato,"Compre lentes de contato Optima FW da Bausch Lomb aqui na Newlentes, referênciua em lentes desde 2010. Aproveite nosso Frete Grátis*",https://www.newlentes.com.br/produto/lentes-de-contato-optima-fw-71285,2026-01-28T15:56:00.762Z,200
130224,Lente de contato colorida Natural Vision anual - Com grau,130224,149,90.7,Lentes de contato,Confira as lentes de contato Natural Vision aqui na NewLentes. São diversas cores e de descarte mensal ou anual. Aproveite nosso frete grátis*.,https://www.newlentes.com.br/produto/lente-de-contato-colorida-natural-vision-anual-com-grau-130224,2026-01-28T15:56:09.672Z,200
129788,Lentes de contato coloridas Natural Colors - Kit sem grau,129788,196,186.2,Lentes de contato,,https://www.newlentes.com.br/produto/lentes-de-contato-coloridas-natural-colors-kit-sem-grau-129788,2026-01-28T15:56:20.897Z,200
71281,Lente de contato Hidroblue Toric,71281,338.9,321.96,Lentes de contato,Compre lentes de contato com grau Hidroblue Toric da Solótica aqui na NewLentes. Compra segura com frete grátis e desconto à vista.,https://www.newlentes.com.br/produto/lente-de-contato-hidroblue-toric-71281,2026-01-28T15:56:30.321Z,200
71278,Lentes de Contato Optogel Op 60,71278,218.5,149,Lentes de contato,Compre lentes de contato com grau OP 60 Optolentes aqui na NewLentes. Compra Segura com Frete Grátis para todo Brasil e Desconto no pagamento á vista.,https://www.newlentes.com.br/produto/lentes-de-contato-optogel-op-60-71278,2026-01-28T15:56:39.187Z,200
130207,Lentes de contato Natural Vision anual,130207,149,146.3,Lentes de contato,As lentes de contato Natural Vision são para correção de miopia ou hipermetropia. Aproveite nosso frete grátis* para todo Brasil e desconto à vista.,https://www.newlentes.com.br/produto/lentes-de-contato-natural-vision-anual-130207,2026-01-28T15:56:47.494Z,200
129785,Lentes de contato coloridas Natural Look - Sem grau,129785,186.2,165,Lentes de contato,Lentes de Contato Colorida Natural Look,https://www.newlentes.com.br/produto/lentes-de-contato-coloridas-natural-look-sem-grau-129785,2026-01-28T15:56:58.365Z,200
130225,Lentes de contato coloridas Natural Vision anual - Sem grau,130225,199.99,186.2,Lentes de contato,Mude o visual com as lentes de contato Natural Vision. Compre com frete grátis* para todo Brasil. Aproveite.,https://www.newlentes.com.br/produto/lentes-de-contato-coloridas-natural-vision-anual-sem-grau-130225,2026-01-28T15:58:13.928Z,200
82602,Lente de contato colorida Hidrocor Tórica,82602,460,437,Lentes de contato,"Compre lentes de contato colorida Hidrocor Tórica da Solótica aqui na NewLentes, com frete grátis e desconto no pagamento à vista.",https://www.newlentes.com.br/produto/lente-de-contato-colorida-hidrocor-torica-82602,2026-01-28T15:58:24.965Z,200
82603,Lente de contato colorida Natural Colors Tórica,82603,600,460,Lentes de contato,Lentes de Contato Colorida NATURAL COLORS TÓRICA,https://www.newlentes.com.br/produto/lente-de-contato-colorida-natural-colors-torica-82603,2026-01-28T15:58:35.622Z,200
134173,Lente de contato colorida Optycolor Magic Top HD,134173,149,99,Lentes de contato,"Compre Lente de contato colorida Optycolor Magic Top HD do fabricante Optolentes por apenas R$ 99,00 aqui na Newlentes. Somos revendedor autorizado Optolentes",https://www.newlentes.com.br/produto/lente-de-contato-colorida-optycolor-magic-top-hd-134173,2026-01-28T15:58:46.377Z,200
130126,Lentes de Contato Coloridas Magic Top - Graus Altos,130126,570,320,Lentes de contato,Compre lentes de contato coloridas Magic Top com graus altos aqui na NewLentes. Aproveite nossa promoção de frete grátis para todo Brasil.,https://www.newlentes.com.br/produto/lentes-de-contato-coloridas-magic-top-graus-altos-130126,2026-01-28T15:58:56.605Z,200
71277,Lentes de Contato Optogel Op 42,71277,303.36,266.72,Lentes de contato,Compre lentes de contato com grau OP 42 Optolentes aqui na NewLentes. Compra Segura com Frete Grátis para todo Brasil e Desconto no pagamento á vista.,https://www.newlentes.com.br/produto/lentes-de-contato-optogel-op-42-71277,2026-01-28T15:59:05.987Z,200
130124,Lentes de Contato Optogel Op 60 - GRAUS ALTOS,130124,570,304,Lentes de contato,Compre as lentes de contato OP 60 com graus altos aqui na NewLentes. Parcelamento sem juros ou desconto no pagamento à vista. Confira!,https://www.newlentes.com.br/produto/lentes-de-contato-optogel-op-60-graus-altos-130124,2026-01-28T15:59:17.053Z,200
130134,Lentes de Contato Optogel Op 42 - GRAUS ALTOS,130134,570,304,Lentes de contato,Compre as lentes de contato Optogel OP 42 para graus altos aqui na NewLentes com facilidade e segurança. Aproveite nossa promoção de frete grátis*.,https://www.newlentes.com.br/produto/lentes-de-contato-optogel-op-42-graus-altos-130134,2026-01-28T15:59:26.350Z,200
135013,Lentes de contato Biosoft Tórica HD,135013,437,359.1,Lentes de contato,"Compre Lentes de contato Biosoft Tórica HD do fabricante Central Oftálmica por apenas R$ 130,00 aqui na Newlentes. Somos revendedor autorizado Central Oftálmica",https://www.newlentes.com.br/produto/lentes-de-contato-biosoft-torica-hd-135013,2026-01-28T15:59:35.507Z,200
134562,Lentes de contato Ultra para Astigmatismo,134562,420.99,333.67,Lentes de contato,"Compre Lentes de contato Ultra para Astigmatismo do fabricante Bausch Lomb por apenas R$ 333,67 aqui na Newlentes. Somos revendedor autorizado Bausch Lomb",https://www.newlentes.com.br/produto/lentes-de-contato-ultra-para-astigmatismo-134562,2026-01-28T15:59:44.791Z,200
130320,Lentes de Contato Purevision 2 para Astigmatismo,130320,386.99,316.99,Lentes de contato,Compre Lentes de Contato Purevision 2 para Astigmatismo aqui na NewLentes com garantia e segurança. Aproveite nosso frete grátis* e desconto à vista,https://www.newlentes.com.br/produto/lentes-de-contato-purevision-2-para-astigmatismo-130320,2026-01-28T15:59:53.565Z,200
71319,Lentes de Contato Solflex Toric,71319,570,350,Lentes de contato,Compre lentes de contato com grau Solflex Tóric Solótica aqui na NewLentes. Compra Segura com Frete Grátis para todo Brasil e Desconto no pagamento à vista.,https://www.newlentes.com.br/produto/lentes-de-contato-solflex-toric-71319,2026-01-28T16:00:04.036Z,200
136721,Lentes de contato Bioview 55 Torica,136721,331.55,303.36,Lentes de contato,"Compre Lentes de contato Bioview 55 Torica do fabricante Central Oftálmica por apenas R$ 290,00 aqui na Newlentes. Somos revendedor autorizado Central Oftálmica",https://www.newlentes.com.br/produto/lentes-de-contato-bioview-55-torica-136721,2026-01-28T16:00:13.599Z,200
137056,Lentes de contato precision 1 day tórica,137056,437,359.1,Lentes de contato,"Compre Lentes de contato precision 1 day tórica do fabricante Alcon por apenas R$ 284,21 aqui na Newlentes. Somos revendedor autorizado Alcon",https://www.newlentes.com.br/produto/lentes-de-contato-precision-1-day-torica-137056,2026-01-28T16:00:23.887Z,200
131326,Lentes de contato Silidrogel Sihy 45 Tórica,131326,437,378,Lentes de contato,"Compre Lentes de contato Silidrogel Sihy 45 Tórica do fabricante Central Oftálmica por apenas R$ 378,00 aqui na Newlentes. Somos revendedor autorizado Central Oftálmica",https://www.newlentes.com.br/produto/lentes-de-contato-silidrogel-sihy-45-torica-131326,2026-01-28T16:00:32.622Z,200
71276,Lentes de Contato Optogel Tórica,71276,800,760,Lentes de contato,Compre lentes de contato com grau Optogel Toric Optolentes aqui na NewLentes. Compra Segura com Frete Grátis e Desconto no pagamento à vista.,https://www.newlentes.com.br/produto/lentes-de-contato-optogel-torica-71276,2026-01-28T16:00:41.930Z,200
131323,Lentes de contato Bioview Tórica,131323,359.1,331.55,Lentes de contato,"Compre as Lentes de contato Bioview Tórica aqui na NewLentes com Frete Grátis e entrega rápida para todo Brasil, aproveite!",https://www.newlentes.com.br/produto/lentes-de-contato-bioview-torica-131323,2026-01-28T16:00:51.408Z,200
